{
  "schema_version": "evaluation-development-pilot/v1",
  "pilot_id": "linkapi_dev_pilot_v1",
  "status": "frozen",
  "split": "dev",
  "experiment_digest": "sha256:aaaaaaaaaaaaaaaaaaaaaaaaaaaaaaaaaaaaaaaaaaaaaaaaaaaaaaaaaaaaaaaa",
  "trial_spec_manifest_digest": "sha256:bbbbbbbbbbbbbbbbbbbbbbbbbbbbbbbbbbbbbbbbbbbbbbbbbbbbbbbbbbbbbbbb",
  "provider_adapter_digest": "sha256:cccccccccccccccccccccccccccccccccccccccccccccccccccccccccccccccc",
  "credential_env_name": "LINKAPI_API_KEY",
  "trial_count": 30,
  "max_total_provider_calls": 60,
  "max_total_output_tokens": 61440,
  "maximum_spend": {"currency": "USD", "decimal": "5.00"},
  "transport_retry_policy": {"automatic_retries": 0, "reason": "unverified_provider_idempotency"},
  "decision_eligible": false,
  "conclusion": "development_only"
}
